{
  "version": "1.0",
  "exchange": "binance",
  "category": "fees",
  "date": "2026-06",
  "screenshotWidth": 1440,
  "screenshotHeight": 709,
  "notes": "BN-038 flagship: regular user fee row",
  "annotations": [
    {
      "type": "focus",
      "rect": [
        313,
        262,
        815,
        30
      ],
      "radius": 4,
      "intensity": "normal"
    }
  ]
}