{
  "version": "1.0",
  "exchange": "binance",
  "category": "bonus",
  "date": "2026-06",
  "screenshotWidth": 1440,
  "screenshotHeight": 712,
  "notes": "Owner full rewards hub: 4 Stage 1 tasks incl. Trade 2000",
  "annotations": [
    {
      "type": "focus",
      "rect": [
        363,
        448,
        230,
        180
      ],
      "radius": 10,
      "intensity": "normal"
    }
  ]
}