{
  "version": "1.0",
  "exchange": "binance",
  "category": "fees",
  "date": "2026-06",
  "screenshotWidth": 1440,
  "screenshotHeight": 709,
  "notes": "BN-039 flagship: USD-M futures regular fee row",
  "annotations": [
    {
      "type": "focus",
      "rect": [
        418,
        226,
        594,
        26
      ],
      "radius": 4,
      "intensity": "normal"
    }
  ]
}